,text
605,"This has resulted in the invention of many devices which are useful to humans, for example cellular telephones, microwave ovens, radios, televisions and many more."
606,The study of electrical circuits is essential to understand the technology that uses electricity in the real-world
607,We depend on electricity and electrical appliances to make many things possible in our daily lives
608,"This becomes very clear when there is a power failure and we can't use the kettle to boil water for tea or coffee, can't use the stove or oven to cook dinner, can't charge our cellphone batteries, watch TV, or use electric lights.Units and unit conversions - Physical Sciences, Grade 10, Science skillsEquations - Mathematics, Grade 10, Equations and inequalitiesGraphs - Mathematics, Grade 10, Functions and graphs"
609,"When a chemical reaction occurs, bonds in the reactants break, while new bonds form in the product"
610,"Hydrogen reacts with oxygen to form water, according to the following equation:In this reaction, the bond between the two hydrogen atoms in the molecule will break, as will the bond between the oxygen atoms in the molecule"
611,"New bonds will form between the two hydrogen atoms and the single oxygen atom in the water molecule that is formed as the product.For bonds to break, energy must be absorbed"
612,The energy that is needed to break a bond is called the bond energy or bond dissociation energy
613,Bond energies are measured in units of .Bond energy Bond energy is a measure of bond strength in a chemical bond
614,It is the amount of energy (in ) that is needed to break the chemical bond between two atoms
615,Remember when we discussed bonding (chapter 3) we used the following energy diagram:We can use this diagram to understand why bond breaking requires energy and bond making releases energy
616,"When a bond breaks, the atoms move apart and the distance between them increases (i.e"
617,the atom moves to the right on the -axis or from point X to point A)
618,"Looking at the diagram we see that when this happens, the energy increases (i.e"
619,the energy at point A is greater than the energy at point X)
620,So when a bond breaks energy is needed.When a bond forms the atoms move closer together and the distance between them decreases (i.e
621,the atom moves to the left on the -axis or from point A to point X)
622,"Looking at the diagram we see that when this happens, the energy decreases (i.e"
623,the energy at point X is less than the energy at point A)
624,So when a bond forms energy is released.Looking at the example of hydrogen reacting with oxygen to form water:We see that energy is needed to break the bonds in the hydrogen molecule and to break the bonds in the oxygen molecule)
625,And we also see that energy is released when hydrogen and oxygen bond to form water)
626,"When we look at the entire reaction and consider both bond breaking and bond forming we need to look at the enthalpy of the system.Enthalpy Enthalpy is a measure of the total energy of a chemical system for a given pressure, and is given the symbol H"
627,A chemical system is a closed system that contains only the reactants and products involved in the reaction.As we learn about exothermic and endothermic reactions we will see more on the concept of enthalpy.
628,Up to now you have looked at reactions as starting with the reactants and going to the products
629,For acids and bases we also need to consider what happens if we swop the reactants and the products around
630,And that when (the base) gains a proton it forms (the acid)
631,In your own words explain what is meant by the term conjugate acid-base pair
632,A conjugate acid-base pair is a reactant and product pair that is transformed into each other through the loss or gain of a proton
633,So for example an acid loses a proton to form a base
634,The acid and the resulting base are said to be a conjugate acid-base pair
635,This chapter looks at the lithosphere and explores mining in more detail
636,"Mining is very important in South Africa as a large part of the economy depends on gold, diamond and coal mining"
637,"This chapter looks at the history of mankind, what the lithosphere is, what is in the lithosphere and then goes on to look at mining"
638,The general techniques used across all types of mining are looked at and then gold mining is explored in greater detail
639,Learners can do the mining section as a project (either in groups or individually) that they then present to the class
640,"If learners do a project ensure that each mineral listed in CAPs (iron, phosphate, coal, diamond, copper, platinum, zinc, chrome, asbestos, manganese and gold) is covered by at least one learner in the class.This topic provides a great opportunity to look at social justice and economic concerns"
641,The various class discussions and debates provided give learners the chance to think about some critical issues in South Africa.In Grade 10 we studied the elements
642,We learnt about the different elements and the compounds that could be formed from those elements
643,Where did mankind find them and how has he used them?This chapter will explore the part of the Earth known as the lithosphere
644,We will find out what the lithosphere is and how the elements are distributed within it.
645,"All the objects that we see in the world around us, are made of matter"
646,"Matter makes up the air we breathe, the ground we walk on, the food we eat and the animals and plants that live around us"
647,Even our own human bodies are made of matter!Different objects can be made of different types of materials (the matter from which objects are made)
648,"For example, a cupboard (an object) is made of wood, nails, hinges and knobs (the materials)"
649,The properties of the materials will affect the properties of the object
650,"In the example of the cupboard, the strength of the wood and metals make the cupboard strong and durable"
651,"Materials that are malleable can be easily formed into different shapes (eg clay, dough)"
652,Ductile materials are able to be formed into long wires (eg copper)
653,The boiling and melting points of substances tells us the temperature at which the substance will boil or melt
654,"This helps us to classify substances as solids, liquids or gases at a specific temperature"
655,The diagram below shows one way in which matter can be classified (grouped) according to its different properties
656,"As you read further in this chapter, you will see that there are also other ways of classifying materials, for example according to whether or not they are good electrical conductors."
657,In this chapter we will explore the states of matter and then look at the kinetic molecular theory
658,We will also examine how the kinetic theory of matter helps explain boiling and melting points as well as other properties of matter
659,Diffusion can be seen as a spreading out of particles resulting in an even distribution of the particles
660,You can see diffusion when you place a drop of food colouring in water
661,"If matter were not made of particles that are constantly moving then we would only see a clump of colour when we put the food colouring in water, as there would be nothing that could move about and mix in with the water"
662,"In 1828 Robert Brown observed that pollen grains suspended in water moved about in a rapid, irregular motion"
663,Brownian motion can also be seen as the random to and fro movement of particles
664,"Matter exists in one of three states, namely solid, liquid and gas"
665,A liquid takes on the shape of the container that it is in
666,Matter can change between these states by either adding heat or removing heat
667,As we heat an object (eg water) it goes from a solid to a liquid to a gas
668,Evaporation from a liquid's surface can happen at a wide range of temperatures
669,If more energy is added then bubbles of gas appear inside the liquid and this is known as boiling
670,Sublimation is the process of going from a solid to a gas
671,Deposition is the process of going from a gas to a solid
672,"If we know the melting and boiling point of a substance then we can say what state (solid, liquid or gas) it will be in at any temperature"
673,A heating curve of a substance gives the changes in temperature as we move from a solid to a liquid to a gas
674,A cooling curve gives the changes in temperature as we move from gas to liquid to solid
675,"An important observation is that as a substance melts or boils, the temperature remains constant until the substance has changed state"
676,This is because all the heat energy goes into breaking or forming the bonds between the molecules
677,The following diagrams give examples of what heating and cooling curves look like:
678,We have now looked at many examples of the types of matter and materials that exist around us and we have investigated some of the ways that materials are classified
679,"In order to understand this, we need to take a closer look at the building blocks of matter — the atom"
680,Atoms are the basis of all the structures and organisms in the universe
681,"The planets, sun, grass, trees, air we breathe and people are all made up of different combinations of atoms.Video: VPrkk"
682,The periodic table of the elements is a method of showing the chemical elements in a table with the elements arranged in order of increasing atomic number
683,Most of the work that was done to arrive at the periodic table that we know can be attributed to a Russian chemist named Dmitri Mendeleev
684,Mendeleev designed the table in 1869 in such a way that recurring (periodic) trends or patterns in the properties of the elements could be shown
685,"Using the trends he observed, he left gaps for those elements that he thought were “missing”"
686,He also predicted the properties that he thought the missing elements would have when they were discovered
687,Many of these elements were indeed discovered and Mendeleev's predictions were proved to be correct
688,"To show the recurring properties that he had observed, Mendeleev began new rows in his table so that elements with similar properties were in the same vertical columns, called groups"
689,The full periodic table is reproduced at the front of this book
690,"These are the energies needed to remove the second, third, or fourth electron respectively"
691,"If you look at a periodic table, you will see the groups numbered at the top of each column"
692,The groups are numbered from left to right starting with 1 and ending with 18
693,This is the convention that we will use in this book
694,"On some periodic tables you may see that the groups are numbered from left to right as follows: 1, 2, then an open space which contains the transition elements, followed by groups 3 to 8"
695,A period is a horizontal row in the periodic table of the elements
696,"The periods are labelled from top to bottom, starting with 1 and ending with 7"
697,For each element on the periodic table we can give its period number and its group number
698,We can also determine the electronic structure of an element from its position on the periodic table
699,In Chapter 4 you worked out the electronic configuration of various elements
700,Using the periodic table we can easily give the electronic configurations of any element
701,"For example, phosphorus () is in the third period and group 15"
702,"Looking at the figure above, we see that the p-orbital is being filled"
703,Similar trends are observed in the other periods of the periodic table
704,The chlorides are compounds with chlorine and the oxides are compounds with oxygen
705,"no oxides, but fluorine does combine with oxygen in compounds called oxygen fluorides"
706,Draw a line graph to show the relationship between atomic number (on the x-axis) and ionisation energy (y-axis)
707,A chemical bond is formed when atoms are held together by attractive forces
708,"This attraction occurs when electrons are shared between atoms, or when electrons are exchanged between the atoms that are involved in the bond"
709,"The sharing or exchange of electrons takes place so that the outer energy levels of the atoms involved are filled, making the atoms are more stable"
710,"If an electron is shared, it means that it will spend its time moving in the electron orbitals around both atoms"
711,If an electron is exchanged it means that it is transferred from one atom to another
712,In other words one atom gains an electron while the other loses an electron.Chemical bond A chemical bond is the physical process that causes atoms and molecules to be attracted to each other and held together in more stable chemical compounds
713,The type of bond that is formed depends on the elements that are involved
714,"In this chapter, we will be looking at three types of chemical bonding: covalent, ionic and metallic bonding.You need to remember that it is the valence electrons (those in the outermost level) that are involved in bonding and that atoms will try to fill their outer energy levels so that they are more stable"
715,"The noble gases have completely full outer energy levels, so are very stable and do not react easily with other atoms."
716,A medium is the substance or material through which a pulse moves
717,The medium does not create the pulse and the medium is not the pulse
718,"Therefore the medium does not travel with the pulse as the pulse moves through it.In each medium, the particles that make up the medium are moved temporarily from their rest position"
719,"In order for a pulse to travel, the different parts of the medium must be able to interact with each other.Medium A medium is the substance or material in which a pulse will move"
720,"The most obvious examples are waves in water, on a dam, in the ocean, or in a bucket"
721,"All waves have the same properties.Waves do not only occur in water, they occur in any kind of medium"
722,Earthquakes release enough energy to create waves that are powerful enough to travel through the rock of the Earth
723,When your friend speaks to you sound waves are produced that travel through the air to your ears
724,A wave is simply the disturbance of a medium by moving energy but how is it different from a pulse?
725,Longitudinal waves A longitudinal wave is a wave where the particles in the medium move parallel to the direction of propagation of the wave
726,When we studied transverse waves we looked at two different motions: the motion of the particles of the medium and the motion of the wave itself
727,We will do the same for longitudinal waves.The question is how do we construct such a wave?A longitudinal wave is seen best in a slinky spring
728,Do the following investigation to find out more about longitudinal waves.From the investigation you will have noticed that the disturbance moves parallel to the direction in which the spring was pulled
729,The ribbon in the investigation represents one particle in the medium
730,"The particles in the medium move in the same direction as the wave.Video: VPdkfAs in the case of transverse waves the following properties can be defined for longitudinal waves:wavelength, amplitude, period, frequency and wave speed."
731,A tuning fork is an instrument used by musicians to create sound waves of a specific frequency
732,They are often used to tune musical instruments.Sound waves coming from a tuning fork are caused by the vibrations of the tuning fork which push against the air particles in front of it
733,As the air particles are pushed together a compression is formed
734,The particles behind the compression move further apart causing a rarefaction
735,"As the particles continue to push against each other, the sound wave travels through the air"
736,"Due to this motion of the particles, there is a constant variation in the pressure in the air"
737,"This means that in media where the particles are closer together, sound waves will travel faster.Tuning forkSound waves travel faster through liquids, like water, than through the air because water is denser than air (the particles are closer together)"
738,Sound waves travel faster in solids than in liquids.A sound wave is a pressure wave
739,This means that regions of high pressure (compressions) and low pressure (rarefactions) are created as the sound source vibrates
740,These compressions and rarefactions arise because the source vibrates longitudinally and the longitudinal motion of air produces pressure fluctuations.
741,The most common example of electromagnetic (EM) radiation is visible light
742,"Everyone is very familiar with light in everyday life, you can only see things because light bounces off them and enters your eyes"
743,This alone makes it worthwhile to learn about it but there are also very many other applications of EM radiation
744,It is called electromagnetic because there are electric and magnetic fields making up the radiation
745,"We will look at this in more detail a little later.In everyday experience, light doesn't seem to have many special properties but it does: A huge spectrum: The light we can see (visible EM radiation) is only a small part of all of the EM radiation (electromagnetic spectrum) that exists"
746,Nature's speed limit: Nothing moves faster than the speed of light
747,Wave nature: All EM radiation has the ability to behave like a wave which we call wave-like behaviour
748,Particle nature: All EM radiation has the ability to behave like a particle which we call particle-like behaviour
749,No medium required: EM radiation can propagate without a medium through which to move even though they are waves
750,We will discuss this in the following sections and in even more detail in Grades 11 and 12.
751,Diagrams of compounds are very useful because they help us to picture how the atoms are arranged in the compound and they help us to see the shape of the compound
752,"There are three types of diagrams that are commonly used: Wireframe or stick models In this model, the bonds between atoms are shown as “sticks”"
753,Ball and stick models This is a 3-dimensional molecular model that uses “balls” to represent atoms and “sticks” to represent the bonds between them
754,The centres of the atoms (the balls) are connected by straight lines which represent the bonds between them
755,Table 12.1 shows examples of the different types of models for all the types of compounds.Covalent molecularCovalent networkIonic networkMetallic networkName of compoundglucosegraphitesilver chloridezincFormula or Stick modelBall-and-stick modelSpace-filling model Table 12.1: Different representations for compounds CanvasMol (www.alteredqualia.com/canvasmol) is a website that allows you to view several compounds
756,"You do not need to know these compounds, this is simply to allow you to see one way of representing compounds."
757,The synthesis (forming) of water () from hydrogen gas () and oxygen gas () is another example of chemical change
758,A simplified diagram of this reaction is shown in Figure 13.3
759,The chemical bonds between in and between in are broken and new bonds between and (to form ) are formed
760,"A chemical change has taken place.Video: VPbhyA mixture of hydrogen and oxygen gas is used as a fuel to get rockets into space.There are some important things to remember about chemical changes: Arrangement of particles During a chemical change, the particles themselves are changed in some way"
761,"In the example of hydrogen peroxide that was used earlier, the molecules were split up into their component atoms"
762,The number of particles will change because each molecule breaks down into two water molecules () and one oxygen molecule ()
763,Energy changes The energy changes that take place during a chemical reaction are much greater than those that take place during a physical change in matter
764,"During a chemical reaction, energy is used up in order to break bonds and then energy is released when the new product is formed"
765,Reversibility Chemical changes are far more difficult to reverse than physical changes
766,"When hydrogen peroxide decomposes into water and oxygen, it is almost impossible to get back to hydrogen peroxide"
767,"Mass conservation Mass is conserved during a chemical change, but the number of molecules may change"
768,"In the example of the decomposition of hydrogen peroxide, for every two molecules of hydrogen peroxide that decomposes, three molecules are formed (two water and one oxygen)"
769,"Table 13.1 highlights these concepts for the decomposition of hydrogen peroxide.Moleculestwo moleculesthree moleculesEnergy changesenergy taken in when bonds are brokenenergy given off when bonds are formedMass is conservedAtoms are conserved oxygen atoms, hydrogen atoms oxygen atoms, hydrogen atoms Table 13.1: Important concepts in chemical change Exercise 13.1See solutions For each of the following say whether a chemical or a physical change occurs"
770,Melting candle wax.Mixing sodium chloride () and silver nitrate () to form silver chloride ().Mixing hydrochloric acid () and magnesium ribbon () to form magnesium chloride ().Dissolving salt in water.Tearing a piece of magnesium ribbon
771,"As we have already mentioned, a number of changes can occur when elements are combined with one another"
772,One way of representing chemical changes is through balanced chemical equations
773,A chemical equation describes a chemical reaction by using symbols for the elements involved
774,"For example, if we look at the reaction between iron and sulfur to form iron sulfide , we could represent these changes in a sentence, in a word equation or using chemical symbols: Sentence: Iron reacts with sulfur to form iron sulfide"
775,A chemical formula shows each element by its symbol and also shows how many atoms of each element are found in that compound
776,The number of atoms (if greater than one) is shown as a subscript.The following exercise serves as revision
777,"Magnetism is an interaction that allows certain kinds of objects, which are called 'magnetic' objects, to exert forces on each other without physically touching"
778,A magnetic object is surrounded by a magnetic 'field' that gets weaker as one moves further away from the object
779,A second object can feel a magnetic force from the first object because it feels the magnetic field of the first object
780,The further away the objects are the weaker the magnetic force will be.Video: VPfkkHumans have known about magnetism for many thousands of years
781,"For example, lodestone is a magnetised form of the iron oxide mineral magnetite"
782,"It is referred to in old European and Asian historical records; from around BCE in Europe and around BCE in Asia.Magnetic objects stuck to a magnetThe root of the English word magnet is from the Greek word magnes, probably from Magnesia in Asia Minor, once an important source of lodestone."
783,Electrostatics is the study of electric charge which is at rest or static (not moving)
784,In this chapter we will look at some of the basic principles of electrostatics as well as the principle of conservation of charge.Video: VPfmg
785,When you measure the potential difference across (or between) the terminals of a battery that is not in a complete circuit you are measuring the emf of the battery
786,"This is the maximum amount of work per coulomb of charge the battery can do to drive charge from one terminal, through the circuit, to the other terminal.The volt is named after the Italian physicist Alessandro Volta (1745–1827).Electrical potential difference is also called voltage.When you measure the potential difference across (or between) the terminals of a battery that is in a complete circuit you are measuring the terminal potential difference of the battery"
787,Although this is measured in volts it is not identical to the emf
788,The difference will be the work done to drive charge through the battery.BatteriesOne lead of the voltmeter is connected to one end of the battery and the other lead is connected to the opposite end
789,The voltmeter may also be used to measure the voltage across a resistor or any other component of a circuit but must be connected in parallel.
790,Many reactions in chemistry and all biological reactions (reactions in living systems) take place in water
791,In this chapter we will look at some of these reactions in detail
792,Almost all the reactions that occur in aqueous solutions involve ions
793,"We will look at three main types of reactions that occur in aqueous solutions, namely precipitation reactions, acid-base reactions and redox reactions"
794,"Before we can learn about the types of reactions, we need to first look at ions in aqueous solutions and electrical conductivity.Video: VPbls"
795,"Sometimes it is important to know exactly how many particles (eg atoms or molecules) are in a sample of a substance, or what quantity of a substance is needed for a chemical reaction to take place.The amount of substance is so important in chemistry that it is given its own name, which is the mole.Mole The mole (abbreviation “mol”) is the SI (Standard International) unit for “amount of substance”"
796,The mole is a counting unit just like hours or days
797,We can easily count one second or one minute or one hour
798,"If we want bigger units of time, we refer to days, months and years"
799,"We call this number Avogadro's number.Avogadro's number The number of particles in a mole, equal to"
800,"If we had this number of cold drink cans, then we could cover the surface of the earth to a depth of over"
801,"If you could count atoms at a rate of 10 million per second, then it would take you 2 billion years to count the atoms in one mole!The original hypothesis that was proposed by Amadeo Avogadro was that “equal volumes of gases, at the same temperature and pressure, contain the same number of molecules”"
