,text
1506,This is useful for learning how to describe the movement (motion) of cars along a straight road or of trains along straight railway tracks
1507,There are three features of motion that we use to describe exactly how an object moves
1508,They are:The jerk is the name we give to how fast the acceleration is changing.Traffic often moves along a straight line
1509,"The word energy comes from the Greek word energeia (ένέργεια), meaning activity or operation"
1510,Energy is closely linked to mass and cannot be created or destroyed
1511,In this chapter we will consider gravitational potential and kinetic energy.Video: VPgjm
1512,"As far as we know, the Earth we live on is the only planet that is able to support life"
1513,"Amongst other factors, the Earth is just the right distance from the sun to have temperatures that are suitable for life to exist"
1514,"Also, the Earth's atmosphere has exactly the right type of gases in the right amounts for life to survive"
1515,"Our planet also has water on its surface, which is something very unique"
1516,"In fact, Earth is often called the “Blue Planet” because most of it is covered in water"
1517,"This water is made up of freshwater in rivers and lakes, the saltwater of the oceans and estuaries, groundwater and water vapour"
1518,"Together, all these water bodies are called the hydrosphere.The EarthVideo: VPbzp"
1519,In this chapter learners will explore Newtons three laws of motion and Newtons law of universal gravitation
1520,Learners will also learn more about forces and the different kinds of forces
1521,The following provides a summary of the topics covered in this chapter.Different kinds of forces
1522,"The types of forces covered are: normal force, frictional force, applied force and tension.Force diagrams and free body diagrams"
1523,In this section learners will see how to take a problem and draw diagrams to show all the forces acting on a body
1524,They will learn what a force diagram is and what a free body diagram is
1525,"Each law is covered in detail and practical applications such as rockets, lifts and seat belts are covered"
1526,Learners are introduced to the ideas of weight and mass as well as the acceleration due to gravity
1527,In this chapter we will learn how a net force is needed to modify the motion of an object
1528,We will recall what a force is and learn about how force and motion are related
1529,"We are also introduced to Newton's three laws and we will learn more about the force of gravity.Ratio and proportion - Physical Sciences, Grade 10, Science skillsEquations - Mathematics, Grade 10, Equations and inequalitiesUnits and unit conversions - Physical Sciences, Grade 10, Science skills"
1530,Covalent bonding involves the sharing of electrons to form a chemical bond
1531,The outermost orbitals of the atoms overlap so that unpaired electrons in each of the bonding atoms can be shared
1532,"By overlapping orbitals, the outer energy shells of all the bonding atoms are filled"
1533,"As they move, there is an attraction between these negatively charged electrons and the positively charged nuclei"
1534,This attractive force holds the atoms together in a covalent bond
1535,Covalent bond A form of chemical bond where pairs of electrons are shared between atoms
1536,We will look at a few simple cases to deduce some rules about covalent bonds
1537,"Remember that it is only the valence electrons that are involved in bonding, and so when diagrams are drawn to show what is happening during bonding, it is only these electrons that are shown"
1538,For this case we will look at hydrogen chloride and methane
1539,The electron configuration of hydrogen is and the electron configuration for chlorine is .The hydrogen atom has valence electron and the chlorine atom has valence electrons
1540,The Lewis diagrams for hydrogen and chlorine are: Notice the single unpaired electron (highlighted in blue) on each atom
1541,"This does not mean this electron is different, we use highlighting here to help you see the unpaired electron"
1542,Notice how the two unpaired electrons (one from each atom) form the covalent bond
1543,"The dot and cross in between the two atoms, represent the pair of electrons that are shared in the covalent bond"
1544,We can also show this bond using a single line: Note how we still show the other electron pairs around chlorine
1545,From this we can conclude that any electron on its own will try to pair up with another electron
1546,So in practise atoms that have at least one unpaired electron can form bonds with any other atom that also has an unpaired electron
1547,"Remember that we said we can place unpaired electrons at any position (top, bottom, left, right) around the elements symbol"
1548,Water is made up of one oxygen and two hydrogen atoms
1549,From what we learnt in the first examples we see that the unpaired electrons can pair up
1550,"Instead of writing the Lewis diagram for hydrogen twice, we simply write it once and use the in front of it to indicate that two hydrogens are needed for each oxygen"
1551,And now we can answer the questions that we asked before the worked example
1552,"We see that oxygen forms two bonds, one with each hydrogen atom"
1553,Oxygen however keeps its electron pairs and does not share them
1554,If an atom has an electron pair it will normally not share that electron pair
1555,A lone pair stays on the atom that it belongs to
1556,A lone pair can be used to form a dative covalent bond
1557,In the example above the lone pairs on oxygen are highlighted in red
1558,When we draw the bonding pairs using lines it is much easier to see the lone pairs on oxygen
1559,Notice the two electron pairs between the two oxygen atoms (highlighted in blue)
1560,"Because these two covalent bonds are between the same two atoms, this is a double bond"
1561,This forms a double covalent bond (which is shown by a double line between the two oxygen atoms)
1562,"Hydrogen has valence electron, carbon has valence electrons and nitrogen has valence electrons"
1563,Notice the three electron pairs (highlighted in red) between the nitrogen and carbon atom
1564,"Because these three covalent bonds are between the same two atoms, this is a triple bond"
1565,Nitrogen keeps its electron pair and shares its three unpaired electrons with carbon
1566,A dative covalent bond is also known as a coordinate covalent bond
1567,Earlier we said that atoms with a pair of electrons will normally not share that pair to form a bond
1568,But now we will see how an electron pair can be used by atoms to form a covalent bond
1569,One example of a molecule that contains a dative covalent bond is the ammonium ion () shown in the figure below
1570,"The hydrogen ion does not contain any electrons, and therefore the electrons that are in the bond that forms between this ion and the nitrogen atom, come only from the nitrogen"
1571,Notice that the hydrogen ion is charged and that this charge is shown on the ammonium ion using square brackets and a plus sign outside the square brackets
1572,We can also show this as: Note that we do not use a line for the dative covalent bond
1573,So in theory atoms that have at least one unpaired electron can form bonds with any other atom that also has an unpaired electron
1574,If an atom has an electron pair it will normally not share that pair to form a bond
1575,If an atom has more than one unpaired electron it can form multiple bonds to another atom
1576,A dative covalent bond can be formed between an atom with no electrons and an atom with a lone pair
1577,There are dots around element Y and from our knowledge of Lewis diagrams we know that these represent the valence electrons
1578,X contributes one electron (represented by a cross) to the bond and X has no other electrons
1579,From our knowledge of Lewis diagrams we look at how many cross and dot pairs there are in the molecule and that gives us the number of covalent bonds
1580,These are single bonds since there is only one dot and cross pair between adjacent atoms
1581,Note that Y could also be sulfur and X hydrogen and the molecule would then be hydrogen sulfide (sulfur dihydride)
1582,"The types of intermolecular forces that occur in a substance will affect its properties, such as its phase, melting point and boiling point"
1583,"You should remember from the kinetic theory of matter (see grade ), that the phase of a substance is determined by how strong the forces are between its particles"
1584,"The weaker the forces, the more likely the substance is to exist as a gas"
1585,This is because the particles are able to move far apart since they are not held together very strongly
1586,"If the forces are very strong, the particles are held closely together in a solid structure"
1587,Remember also that the temperature of a material affects the energy of its particles
1588,"The more energy the particles have, the more likely they are to be able to overcome the forces that are holding them together"
1589,Note that we are showing two dimensional figures when in reality these are three dimensional
1590,"The following five experiments investigate the effect of various physical properties (evaporation, surface tension, solubility, boiling point and capillarity) of substances and determine how these properties relate to intermolecular forces"
1591,A formal experiment on the effects of intermolecular forces is included in this chapter
1592,"In this experiment learners will investigate how intermolecular forces affect evaporation, surface tension, solubility, boiling points and capillarity"
1593,"Some of the substances that are used (nail polish remover (mainly acetone if you use the non acetone free variety), methylated spirits (a mixture of methanol and ethanol), oil (a mostly non-polar hydrocarbon), glycerin (a fairly complex organic molecule)) are quite complex substances and learners may not have the skills needed to determine the types of intermolecular forces at work here"
1594,You should guide learners in this and tell them the intermolecular forces for these substances
1595,You can help learners work out the strength of the intermolecular forces by telling them that larger molecules have stronger intermolecular forces than smaller molecules
1596,This is often a big factor in determining which substance has the strongest intermolecular forces
1597,Each experiment focuses on a different property and sees how that property relates to intermolecular forces
1598,It will often not be easy for learners to see the small differences between some of the molecules chosen and so they need to use a combination of experimental results and knowledge about the strength of the intermolecular force to try and predict what may happen
1599,Each experiment ends with a conclusion about what should be found to guide learners
1600,It is very important to work in a well ventilated room (one with lots of air flow) particularly when working with methanol and ethanol
1601,"Many of the substances used (particularly nail polish remover, ethanol and methylated spirits) are highly flammable and so care must be taken when heating these substances"
1602,It is recommended that learners use a hot plate rather than a Bunsen burner to heat these substances as this reduces the risk of fire
1603,"When doing chemistry experiments it is also extra important to ensure that your learners do not run around, do not try to drink the chemicals, do not eat and drink in the lab, do not throw chemicals on the other learners and in general do act in a responsible and safe way"
1604,The guidelines for safe experimental work can be found in the science skills chapter from grade
1605,From these experiments we can see how intermolecular forces (a microscopic property) affect the macroscopic behaviour of substances
1606,If a substance has weak intermolecular forces then it will evaporate easily
1607,Substances with weak intermolecular forces also have low surface tension and do not rise as far up in narrow tubes as substances with strong intermolecular forces
1608,Substances are more likely to be soluble in liquids with similar intermolecular forces
1609,"We will now look at some more properties (molecular size, viscosity, density, melting and boiling points, thermal expansion, thermal conductivity) in detail"
1610,The carbon atoms link together to form chains of varying lengths
1611,"The boiling point and melting point of these molecules is determined by their molecular structure, and their surface area"
1612,"The more carbon atoms there are in an alkane, the greater the surface area and therefore the higher the boiling point"
1613,The melting point also increases as the number of carbon atoms in the molecule increases
1614,"there are few carbon atoms), the organic compounds are gases because the intermolecular forces are weak"
1615,"As the number of carbon atoms and the molecular mass increases, the compounds are more likely to be liquids or solids because the intermolecular forces are stronger"
1616,You should see that the larger a molecule is the stronger the intermolecular forces are between its molecules
1617,This is one of the reasons why methane () is a gas at room temperature while pentane () is a liquid and icosane () is a solid
1618,"It is partly the stronger intermolecular forces that explain why petrol (mainly octane ()) is a liquid, while candle wax () is a solid"
1619,If these intermolecular forces did not increase with increasing molecular size we would not be able to put liquid fuel into our cars or use solid candles
1620,Compare how easy it is to pour water and syrup or honey
1621,You can see this if you take a cylinder filled with water and a cylinder filled with glycerin
1622,Drop a small metal ball into each cylinder and note how easy it is for the ball to fall to the bottom
1623,"In the glycerin the ball falls slowly, while in the water it falls faster"
1624,Substances with stronger intermolecular forces are more viscous than substances with weaker intermolecular forces
1625,The solid phase is often the most dense phase (water is one noteworthy exception to this)
1626,This can be explained by the strong intermolecular forces found in a solid
1627,These forces pull the molecules together which results in more molecules in one unit volume than in the liquid or gas phases
1628,The more molecules in a unit volume the denser that substance will be
1629,Substances with weak intermolecular forces will have low melting and boiling points while those with strong intermolecular forces will have high melting and boiling points
1630,"In the experiment on intermolecular forces you investigated the boiling points of several substances, and should have seen that molecules with weaker intermolecular forces have a lower boiling point than molecules with stronger intermolecular forces"
1631,One further point to note is that covalent network structures (recall from grade that these are covalent compounds that form large networks and an example is diamond) will have high melting and boiling points due to the fact that some bonds (i.e
1632,the strong forces between atoms) have to break before the substance can melt
1633,"Covalent molecular substances (eg water, sugar) often have lower melting and boiling points, because of the presence of the weaker intermolecular forces holding these molecules together"
1634,As the alcohol (or mercury) is heated it expands and rises up the tube
1635,This is why when you tile a floor you have to leave gaps between the tiles to allow for expansion
1636,It is also why power lines sag slightly and bridges have slight gaps for expansion
1637,Heat is transferred through a substance from the point being heated to the other end
1638,This is why the bottom of a pot gets hot first (assuming you are heating the pot on a stove plate)
1639,"In metals there are some free, delocalised electrons which can help transfer the heat energy through the metal"
1640,"In covalent molecular compounds there are no free, delocalised electrons and the heat does not travel as easily through the material"
1641,Explain why the melting point of oxygen () is much lower than the melting point of hydrogen chloride
1642,"So if a substance has strong intermolecular forces, then that substance will have a high melting point"
1643,We know that stronger intermolecular forces lead to higher melting points
1644,We also know that oxygen has weaker intermolecular forces than hydrogen chloride (induced dipole versus dipole-dipole forces)
1645,Therefore oxygen will have a lower melting point than hydrogen chloride since oxygen has weaker intermolecular forces
1646,Induced dipole forces are the weakest intermolecular forces and hydrogen bonding is the strongest
1647,In order for a liquid to boil the intermolecular forces must be broken and if the intermolecular forces are very strong then it will take a lot of energy to overcome these forces and so the boiling point will be higher
1648,Water has strong intermolecular forces (hydrogen bonds) while carbon tetrachloride only has weaker induced dipole forces
1649,Substances with stronger intermolecular forces take longer to evaporate than substances with weaker intermolecular forces
1650,The type of intermolecular force that can exist when sodium chloride dissolves in methanol is ion-dipole forces
1651,The formation of these forces helps to disrupt the ionic bonds in sodium chloride and so sodium chloride can dissolve in methanol
1652,Tumi and Jason are helping their dad tile the bathroom floor
1653,Their dad tells them to leave small gaps between the tiles
1654,Materials (such as tiles) expand on heating and so small gaps need to be left between the tiles to allow for this expansion
1655,"If Tumi and Jason did not leave these gaps between the tiles, the tiles would soon lift up"
1656,A beam of sunlight through a window lights up a section of the floor
1657,You might draw a series of parallel lines showing the path of the sunlight from the window to the floor
1658,"This is not exactly accurate — no matter how hard you look, you will not find unique lines of light in the sunbeam"
1659,"However, this is a good way to draw light and to model light geometrically, as we will see in this chapter.We call these narrow, imaginary lines of light light rays"
1660,"Recall that light can behave like a wave and so you can think of a light ray as the path of a point on the crest of a wave.We can use light rays to model the behaviour of light relative to mirrors, lenses, telescopes, microscopes, and prisms"
1661,The study of how light interacts with materials is called optics
1662,"When dealing with light rays, we are usually interested in the shape of a material and the angles at which light rays hit it"
1663,"From these angles, we can determine, for example, the distance between an object and its reflection"
1664,"You have learnt about the basic properties of waves before, specifically about reflection and refraction"
1665,"In this chapter, you will learn about phenomena that arise with waves in two and three dimensions: diffraction"
1666,We will also build on interference which you have learnt about previously but now in more than one dimension.
1667,The kinetic theory of matter says that all matter is composed of particles which have a certain amount of energy which allows them to move at different speeds depending on the temperature (energy)
1668,There are spaces between the particles and also attractive forces between particles when they come close together.Now we will look at applying the same ideas to gases.The main assumptions of the kinetic theory of gases are as follows: Gases are made up of particles (eg atoms or molecules)
1669,The size of these particles is very small compared to the distance between the particles
1670,The collisions between particles and the walls of the container do not change the kinetic energy of the system
1671,The temperature of a gas is a measure of the average kinetic energy of the particles
1672,From these assumptions we can define the pressure and temperature of any gas.PressureThe pressure of a gas is a measure of the number of collisions of the gas particles with each other and with the sides of the container that they are in.Video: 23VSTemperatureThe temperature of a substance is a measure of the average kinetic energy of the particles.If the gas is heated (i.e
1673,"the temperature increases), the average kinetic energy of the gas particles will increase and if the temperature is decreased, the average kinetic energy of the particles decreases"
1674,"If the energy of the particles decreases significantly, the gas liquefies (becomes a liquid).One of the assumptions of the kinetic theory of gases is that all particles have a different speed"
1675,For an ideal gas we assume that all particles in the gas have the same speed.So for an ideal gas we can simply talk about the speed of particles
1676,But for a real gas we must use the average speed of all the particles.Video: 23VT
1677,In grade 10 you learnt how to calculate the molar concentration of a solution
1678,The molar concentration of a solution is the number of moles of solute per litre of solvent ()
1679,"This is more commonly given as moles of solute per cubic decimetre of solution ().To calculate concentration we use , where is the molar concentration, is the number of moles and is the volume of the solution.Calculating molar concentrations is useful to determine how much solute we need to add to a given volume of solvent in order to make a standard solution.A standard solution is a solution in which the concentration is known to a high degree of precision"
1680,"When we work with standard solutions we can take the concentration to be constant.When you are busy with these calculations, you will need to remember the following:===, therefore dividing a volume in by will give you the equivalent volume in"
1681,How much sodium chloride (in g) will one need to prepare of a standard solution with a concentration of
1682,The volume must be converted to : To find the mass of we need the molar mass of
1683,We can get this from the periodic table (recall from grade 10 how to calculate the molar mass of a compound).The mass of sodium chloride needed is We will now look at another use of concentration which is for titration calculations.TitrationsA titration is a technique for determining the concentration of an unknown solution
1684,Acid-base reactions and redox reactions are both commonly used for titrations.In grade 10 you did a simple acid-base titration
1685,Now we will look at how to calculate the concentration of an unknown solution using an acid-base titration.When performing a titration we say that the substance of unknown concentration is titrated with the standard solution
1686,A pipette is a measuring device that is used to measure an exact amount of a liquid
1687,If you use a pipette to add liquid to a flask then you would say that the liquid was pipetted into a flask.We can reduce the number of calculations that we have to do in titration calculations by using the following: The and are the stoichiometric coefficients of compounds A and B respectively
1688,It was found that of the sodium hydroxide was needed to neutralise the acid
1689,"Using an acid-base titration, it was found that of this solution was able to completely neutralise of a sodium hydroxide solution"
1690,"First convert the volume into :Then calculate the number of moles of sulfuric acid:Now we can calculate the concentration of the sulfuric acid:Remember that only or of the sulfuric acid solution is used.Exercise 8.2See solutions Acetylene () burns in oxygen according to the following reaction: If of acetylene gas is burnt, what volume of carbon dioxide will be produced"
1691,We first work out what mass of magnesium chloride is needed to make a solution with a concentration of
1692,It was found that of the nitric acid was needed to neutralise the base
1693,"Write down all the information you know about the reaction, and make sure that the equation is balanced"
1694,It was found that of the phosphoric acid was needed to neutralise the base
1695,"Write down all the information you know about the reaction, and make sure that the equation is balanced"
1696,of this solution is then pipetted into a conical flask and titrated with hydrochloric acid
1697,It is found that of the hydrochloric acid completely neutralises the antacid solution
1698,Remember that only or of the calcium carbonate solution is used
1699,This chapter builds on the work covered in electrostatics in grade 10
1700,Learners should be familiar with the two types of charges and with simple calculations of amount of charge
1701,The following list summarises the topics covered in this chapter.Coulomb's law In this part of the topic learners are introduced to Coulomb's law
1702,This is an inverse square law and has a similar form to Newton's law of Universal Gravitation
1703,Electric fields The concept of an electric field is introduced in this part of the chapter
1704,Learners will see how to draw the electric field lines for different configurations of charges and will learn how to determine the magnitude of the electric field
1705,Learners will also learn how to calculate the electric field at a point due to a number of point charges
1706,"In this chapter you will learn exactly how to determine this force and about a basic law of electrostatics.Ratio and proportion - Physical Sciences, Grade 10, Science skillsEquations - Mathematics, Grade 10, Equations and inequalitiesUnits and unit conversions - Physical Sciences, Grade 10, Science skillsScientific notation - Physical Sciences, Grade 10, Science skills"
1707,This chapter takes the ideas of magnetism and the ideas of electricity and combines them into one
