,text
1157,"Objects or systems must have energy to be able to do work on other objects or systems by transferring some of their energy.Units and unit conversions, Physical Sciences, Grade 10, Science skillsEquations - Mathematics, Grade 10, Equations and inequalitiesTechniques of vector addition - Physical Sciences, Grade 10, Vectors and scalarsNewton's laws - Physical Sciences, Grade 11, ForcesForce diagrams - Physical Sciences, Grade 11, ForcesVideo: 27RGWork:Define word done on an object by a force.Understand that work is a scalar.Calculations done on the net work done on an object.Understand the difference of positive, negative and no work done.Drawing of force diagrams to determine the net work done on an object - Ignore perpendicular forces.Work-energy theorem:Know the difference between conservative and non-conservative forces.Understand the result of a net force working in on an object.Application of the work-energy theorem to objects on horizontal and inclined planes.Calculations of different motions of objects.Conservation of energy:Definition of conservative and non-conservative forces and examples.Know the relationship between conservative and non-conservative forces and mechanical energy.Calculations done on the conservation of energy.Using calculations to prove the relationship between non-conservative forces and mechanical energy.Power:Definition of power as the rate at which work is done.Calculations done when work is done.Understand what is needed to keep an object moving at a constant speed.Calculations done when an object moves at a constant speed.Calculations done on power.Calculations done on maximum and minimum power.Units and unit conversions, Physical Sciences, Grade 10, Science skillsEquations - Mathematics, Grade 10, Equations and inequalitiesTechniques of vector addition - Physical Sciences, Grade 10, Vectors and scalarsNewton's laws - Physical Sciences, Grade 11, ForcesForce diagrams - Physical Sciences, Grade 11, Forces"
1158,"Have you noticed how the pitch of a police car or ambulance siren changes as it passes where you are standing, or how an approaching car or train sounds different to when it is tavelling away from you"
1159,"If you haven't, try to do an experiment by paying extra careful attention the next time it happens to see if you can notice a difference in pitch"
1160,"This doesn't apply to just vehicles and trains but anything that emits waves, be those sound waves or any other electromagnetic (EM) waves.The effect actually occurs if you move towards or away from the source of the sound as well"
1161,"This effect is known as the Doppler effect and will be studied in this chapter.The Doppler effect is named after Johann Christian Andreas Doppler (29 November 1803 - 17 March 1853), an Austrian mathematician and physicist who first explained the phenomenon in 1842.Video: 27SRUnits and unit conversions - Physical Sciences, Grade 10, Science skillsEquations, Mathematics - Grade 10, Equations and inequalitiesSound waves - Physical Sciences, Grade 10, SoundElectromagnetic radiation - Physical Sciences, Grade 10, Electromagnetic radiationThe Doppler Effect with sound:Definition of the Doppler Effect with examples.Explanation to what happens with sound when objects move relative to each other.Calculations done to determine the frequency when one of the two objects are moving.Description of applications with ultra sound waves.THE Doppler Effect with light:Understand the relationship between light and the Doppler Effect.Application of the Doppler Effect and light concerning the universe.Units and unit conversions - Physical Sciences, Grade 10, Science skillsEquations - Mathematics, Grade 10, Equations and inequalitiesSound waves - Physical Sciences, Grade 10, SoundElectromagnetic radiation - Physical Sciences, Grade 10, Electromagnetic radiation"
1162,"A car slowly rusting away, a match burning, a tablet dissolving in water"
1163,All of these are chemical reactions and all of these take place at different rates
1164,"If you were to hold a race between these three reactions you would find that the match wins (it burns quickly), while the car rusting would lose (it may take years to rust).In this chapter we will look at why reactions proceed at different rates (speeds) and how we can change the rate of the reaction.In physics, speed is the scalar measurement that tells us how fast or slow an object is moving (position vs"
1165,For reactions the speed (or rate) of a reaction means how fast or slow the reaction is and indicates the amount of product formed and the amount of reactants used per unit time.
1166,To define chemical equilibrium we need to ask some important questions about reactions: Does a reaction always run its full course so that all the reactants are used up
1167,When all the reactants in a reaction are used up the reaction is said to have gone to completion
1168,Does a reaction always proceed in the same direction or can it be reversed
1169,"In other words, does a reaction always proceed reactants products, or is it possible that a reaction will reverse and go products reactants"
1170,"However, in some reactions the reactants form products (in a ), and the products can change back into reactants (in a )"
1171,"Can a reaction reach a point where reactants are still present, but there does not seem to be any further change taking place in the reaction"
1172,"In all reactions, as the amount of reactant in a reaction decreases the product is formed more slowly"
1173,"In a reversible reaction, as the amount of product increases the reactant is formed more quickly"
1174,Eventually the rate of the forward reaction (reactants products) equals the rate of the reverse reaction (products reactants)
1175,At this point there but there does not appear to be any further change taking place
1176,Chemical equilibrium is the state of a reversible reaction where the rate of the forward reaction equals the rate of the reverse reaction
1177,While a reaction is in equilibrium the concentration of the reactants and products are constant.Chemical equilibrium A reaction is in chemical equilibrium when the rate of the forward reaction equals the rate of the reverse reaction
1178,In the bottle there is carbon dioxide () dissolved in the liquid
1179,There is also gas in the space between the liquid and the cap
1180,"There is a constant movement of from the liquid to the gas phase, and from the gas phase into the liquid"
1181,"However, if you look at the bottle there does not appear to be any change"
1182,The system is in equilibrium.Without chemical equilibrium life as we know it would not be possible
1183,Another example of equilibrium in our everyday lives goes on within our very bodies
1184,"The haemoglobin has to be able to take up oxgen, but also to release it and this is done through changes in the chemical equilibrium of this reaction in different places in our bodies.haemoglobin(aq) + haemoglobin((aq)Haemoglobin, inside red blood cells in the lungs, bonds with oxygen"
1185,This oxyhaemoglobin moves with the red blood cells through the blood stream to cells throughout the body.This video is a good demonstration of how a reaction reaches equilibrium with time.Video: 27VFThe important thing for the students to understand in this experiment is that there is constant movement
1186,"Molecules at the surface of the water in the closed beaker are constantly evaporating, and gas molecules are constantly condensing"
1187,"There is no change in the level of the liquid and the total number molecules in the liquid and the gas state remain constant.Point out that the level of water in the sealed container also drops initially, before finally remaining constant"
1188,This concept will help learners understand how the rate of the forward reaction decreases until equilibrium is reached.Evaporation is when a substance goes from the liquid phase to the gas phase (it evaporates)
1189,Condensation is when a substance goes from the gas phase to the liquid phase (it condenses).The bottle contains water vapour (gas) and water droplets are condensing on the side of the bottle.An open system is one in which matter or energy can flow into or out of the system
1190,"In the liquid-gas demonstration we used, the first beaker was an example of an open system because the beaker could be heated or cooled (a change in energy), and water vapour (the matter) could evaporate from the beaker.Open system An open system is one whose borders allow the movement of energy and matter into and out of the system"
1191,"A closed system is one in which energy can enter or leave, but matter cannot"
1192,The second beaker with the glass cover is an example of a closed system
1193,"The beaker can still be heated or cooled, but water vapour cannot leave the system because the glass cover is a barrier"
1194,Condensation changes the vapour to liquid and returns it to the beaker
1195,"In other words, there is no loss of matter from the system.Generally, some of the molecules at the surface of liquids and solids are moving into the gas phase"
1196,"However, this is such a small fraction of the total volume of the liquid or solid that a reaction involving only solids or liquids can be considered a closed system.It is useful to simplify situations in science by dividing the world into the system we are studying, and the surrounding environment that might influence the reaction, but is not part of it.Closed system A closed system is one in which only energy can move into and out of the system"
1197,Matter cannot be gained by the system nor lost from the system
1198,"In a closed system it is possible for reactions to be reversible, such as in the demonstration above"
1199,"In a closed system, it is also possible for a chemical reaction to reach equilibrium.Some reactions can take place in two directions"
1200,"In the other direction, the products react to form the reactants again"
1201,A special double-headed arrow ( ) is used to show this type of :A reversible reaction A reversible reaction is a chemical reaction that can proceed in both the forward and reverse directions
1202,"In other words, the reactants and products of the reaction may reverse roles"
1203,Remember that implies that A goes to B and cannot become A again
1204,"A can go to B and B can go to A.So, in the following reversible reaction: is the reaction.The forward reaction is always taken from the given equation and written: left to right"
1205,is the reaction.The reverse reaction is always taken from the given equation and written: right to left.Exercise 8.1See solutionsWhich of the following situations describes a closed system
1206,The water vapour can leave the pot (system) if there is no lid
1207,Assume that none of the solid or liquid reactants or products go into the gas phase
1208,"Initially (time = ), the rate of the is high (fast)"
1209,As the reaction gets closer to equilibrium the rate of decrease levels out until the forward reaction has a constant rate.Initially the rate of the is low (slow)
1210,"As the reaction progresses the rate of increase levels out until the reverse reaction has a constant rate.At this point the forward and reverse reaction rates are equal and this is called .Although it is not always possible to observe any macroscopic changes, this does not mean that the reaction has stopped"
1211,The forward and reverse reactions continue to take place and so microscopic changes still occur in the system
1212,This state is called dynamic equilibrium.Dynamic equilibrium There is a dynamic equilibrium in a reversible reaction when the rate of the forward reaction equals the rate of the reverse reaction
1213,"In the liquid-gas phase equilibrium demonstration, dynamic equilibrium was reached when there was no observable change in the level of the water in the second beaker even though evaporation and condensation continued to take place.For more information on dynamic equilibriums watch this video:Video: 27VJ"
1214,A different concept to strong and weak is the concept of concentrated and dilute
1215,Thus a strong acid can be prepared as either a concentrated or a dilute solution
1216,A solution of which the exact concentration is known is called a standard solution
1217,A concentrated solution is one where a large amount of a substance (solute) has been added to a solvent
1218,Note that both strong and weak acids and bases can be used in concentrated solutions
1219,Concentrated solution A concentrated solution is one where there is a high ratio of dissolved substance (eg acid or base) to solvent
1220,A dilute solution is one where a small amount of a substance has been added to a solvent
1221,Note that both strong and weak acids and bases can be used in dilute solutions
1222,A concentrated solution has a lot of solute molecules (red circles) in the solvent
1223,A dilute solution has few solute molecules (red circles) in the solvent
1224,Dilute solution A dilute solution is one where there is a low ratio of dissolved substance to solvent
1225,A concentrated solution can be made from a strong or a weak acid or base
1226,A dilute solution can also be made from a strong or a weak acid or base
1227,Whether a solution is concentrated or dilute depends on how much of the acid or base was added to the solvent
1228,"A strong base that is also concentrated would be a base that almost completely dissociates when added to a solution, and you also add a large amount of the base to the solution"
1229,"A weak acid that is also dilute would be an acid where only a small percentage of molecules ionise when added to a solution, and you also add only a small amount of the acid to the solution"
1230,The electrical conductivity of a solution depends on the concentration of mobile ions in the solution
1231,"This means that a concentrated solution of a strong acid or base will have a high electrical conductivity, while a dilute solution of a weak acid or base will have a low electrical conductivity"
1232,"Therefore, the more ions (charged particles) there are in a solution, the greater the electric current that can be conducted through the solution by the charged particles"
1233,These include ions in solution and ions in melted ionic materials
1234,Only a small percentage of the molecules dissociate in the solution
1235,Almost complete ionisation or dissociation means an acid or base is strong
1236,Only a small amount of ionisation or dissociation means an acid or base is weak
1237,"Almost all the molecules ionise in the solution, therefore is a strong acid"
1238,"Only a small percentage of the molecules dissociate, therefore is a weak base"
1239,A concentrated solution has a high ratio of solute to solvent
1240,A dilute solution has a low ratio of solute to solvent
1241,"This is a high ratio, therefore the solution of is concentrated"
1242,"This is a low ratio, therefore the solution of is dilute"
1243,Only a small percentage of the molecules ionise in the solution
1244,Almost complete ionisation or dissociation means an acid or base is strong
1245,Only a small amount of ionisation or dissociation means an acid or base is weak
1246,"Almost all the molecules dissociate in the solution, therefore is a strong base"
1247,"Only a small percentage of the molecules ionise, therefore is a weak acid"
1248,A concentrated solution has a high ratio of solute to solvent
1249,A dilute solution has a low ratio of solute to solvent
1250,"This is a low ratio, therefore the solution of is dilute"
1251,"This is a high ratio, therefore the solution of is concentrated"
1252,To do that the molar mass (M) needs to be calculated
1253,M() = ( x ) + + ( x ) =
1254,To do that the molar mass (M) needs to be calculated
1255,For every mole of a solvent there are moles of lithium hydroxide ()
1256,There are many more moles of the base than the solvent
1257,For every moles of a solvent there are moles of nitric acid ()
1258,There are many more moles of the solvent than the acid
1259,% of an unknown acid donates protons when the acid is added to water
1260,This means that it almost completely forms ions in solution and is therefore a strong acid
1261,Is a solution with a pH of strongly or weakly acidic
1262,Although this is a strong acid the solution is only weakly acidic
1263,This means that there must be a very small number of moles of the acid in the total volume of the solution
1264,You need the number of moles (n) and the molar mass (M)
1265,You need the number of moles (n) and the molar mass (M)
1266,"You have the volume (V) and original concentration of the ammonia solution, you need number of moles (n) in that original solution"
1267,Therefore n = C x V n(original solution of ) = x =
1268,The final volume used to calculate the concentration must be the volume of the water plus the volume of ammonia added
1269,The study of electrical circuits is essential to understanding the technology that uses electricity in the real-world
1270,"In this chapter we will focus on revising content from Grade 11 and extending our understanding of the internal structure of a battery/cell and how this influences what you already know about circuits.Units and unit conversions- Physical Sciences, Grade 10, Science skillsCircuit components- Physical Sciences, Grade 10, Electric circuitsOhm's law - Physical Sciences, Grade 11, Electric circuitsSeries and parallel components - Physical Sciences, Grade 11, Electric circuitsEquations - Mathematics, Grade 10, Equations and inequalitiesSeries and parallel networks of resistors:Understanding of Ohm's Law.The meaning of conservation of charge and energy for different types of circuits.Calculations done using series and parallel circuits.Solve problems involving current, voltage and resistance for circuits.Batteries and internal resistance:State that a real battery has internal resistance.Definition of a load.Do experiments of finding the internal resistance of a battery.Do calculations by using circuits with batteries with internal resistance.Evaluating internal resistance in circuits:Solve circuit problems using batteries with internal resistance with series, parallel and series-parallel circuits.Extension: Wheatstone Bridge:Definition of a Wheatstone Bridge.Solve problems concerning the Wheatstone Bridge.Units and unit conversions- Physical Sciences, Grade 10, Science skillsCircuit components- Physical Sciences, Grade 10, Electric circuitsOhm's law - Physical Sciences, Grade 11, Electric circuitsSeries and parallel components - Physical Sciences, Grade 11, Electric circuitsEquations - Mathematics, Grade 10, Equations and inequalities"
1271,In Grade 11 you learnt how a magnetic field is generated around a current-carrying conductor
1272,You also learnt how a current is generated in a conductor that moves in a magnetic field or in a stationay conductor in a changing magnetic field
1273,"This chapter describes how conductors moving in a magnetic field are applied in the real-world.Today, currents induced by magnetic fields are essential to our technological society"
1274,"The ubiquitous generator—found in automobiles, on bicycles, in nuclear power plants, and so on—uses magnetism to generate current"
1275,"Other devices that use magnetism to induce currents include pickup coils in electric guitars, transformers of every size, certain microphones, airport security gates, and damping mechanisms on sensitive chemical balances"
1276,"Not so familiar perhaps, but important nevertheless, is that the behavior of AC circuits depends strongly on the effect of magnetic fields on currents.Electrical machines - generators and motors:State the difference between generators and motors.Definition of Farady's Law.Using Farady's Law for explanations.Definition of a generatorExplaining the principle of an AC and DC generator using words and pictures.Explaining the difference between AC and DC generators.Explains what happens when a current carrying coil is placed in a magnetic field.Explaining the principle of an electric motor using word and pictures.Definition of Lorent Force.Examples of AC and DC generators and the use of motors.Alternating current:Explaining advantages of alternating current.Write different expressions.Definition of the root mean square values and explains why they are useful.Calculations done on the average power.Drawing of graphs.Solve different kinds of problems using alternating current."
1277,Many people are using solar power as a source of energy for their homes
1278,Solar power can be used to heat water or to supply electricity
1279,Have you ever wondered how solar energy is converted to electrical energy
1280,"In this chapter, we examine the process that is used to achieve this energy conversion.Video: 27Z3Units and unit conversions - Physical Sciences, Grade 10, Science skillsEquations - Mathematics, Grade 10, Equations and inequalitiesElectronic configuration- Physical Sciences, Grade 10, The atomElectromagnetic radiation- Physical Sciences, Grade 10, Electromagnetic radiationPhotoelectric effect:Description of the photoelectric effect.Give the significance of the photoelectric effect.Definition of the cut-off frequency.Definition of the work function and that it is material specificThe relationship between the cutt-off frequency and maximum wavelength.Calculations using the photoelectric equation.Knowing the relationship between the number of electrons and intensity of the incident radiation.Understanding the nature between the photoelectric effect and the particle of nature of light.Emission and absorption spectra:Explanation of the source atomic emission spectra and their unique relationship to each element.Relation between the atomic spectrum and the electron transitions between energy levels.Explaining the difference between atomic absorption and emission spectra.Applications of emission and absorption spectra.Units and unit conversions - Physical Sciences, Grade 10, Science skillsEquations - Mathematics, Grade 10, Equations and inequalitiesElectronic configuration- Physical Sciences, Grade 10, The atomElectromagnetic radiation- Physical Sciences, Grade 10, Electromagnetic radiation"
1281,An easy way to remember this is:In both oxidation and reduction a transfer of electrons is involved resulting in a change in the oxidation state of the elements
1282,"In each of the following reactions say whether the reactant iron species (, , ) is oxidised or reduced"
1283,"This section studies the use of resources, more specifically phosphate rock, natural gas and other gases (like nitrogen and oxygen) to produce fertilisers to sustain a food supply for people on Earth"
1284,The industrial processes that are involved in the manufacturing of fertilisers are studied
1285,"The purpose of studying this industry is to make learners aware of the impact of human activities on the environment and our responsibility to use our resources sustainably.Prior knowledgeThis section of work is done at the end of the Grade 12 year and provides an ideal opportunity to revise some of the concepts covered in redox reactions, rates and extent of reactions, acid-base reactions and balancing of equations"
1286,The prior knowledge for this chapter includes a general awareness that the chemistry that is done at school has application in industrial processes in South Africa and elsewhere
1287,"Two examples that would have been covered in the electrochemistry section, namely the production of chlorine and the recovery of aluminium metal from bauxite, can provide a useful context to study further application of chemistry in real life"
1288,"Furthermore, this section also builds on learners’ prior knowledge of the lithosphere and how we are using these resources on Earth.PlanningCAPS allocates 6 hours for this section"
1289,"The suggested lessons can be adapted, depending on the length of the lessons at your school and how much time you have to teach the section"
1290,Introduction to the importance of nutrients This section covers the importance of nutrients and is necessary to understand the role of fertilisers
1291,In this lesson learners should do the concept map activity as a way of summarising the information
1292,"Learners should start on the investigation of fertiliser use in their area from this first lesson, as it is a long investigation and requires a community survey"
1293,The role of fertilisers In this lesson the role of fertilisers should be covered
1294,This includes an understanding of the NPK ratios and the specific nutrients found in different fertilisers
1295,The industrial preparation of fertilisers This section covers the industrial production of chemicals used in inorganic fertilisers
1296,At the end of the section there is a worksheet for the learners to complete
1297,"The worksheet, as well as the answer sheet is provided in this book"
1298,"This is a long section and, if time allows, should be covered over three lessons"
1299,Alternative sources of fertilisers In this lesson learners should understand and be able to name alternative sources of fertilisers
1300,At the end of the lesson they should complete the activity on alternative sources
1301,The investigation on fertiliser use in their area should be looked at
1302,They should have designed their survey and be collecting their data
1303,Fertilisers and the environment Eutrophication is one of the serious effects fertilisers can have on the environment
1304,"After going through this section the learners should go through the activity on dealing with the consequences of eutrophication, discussing how best to deal with this problem"
1305,The learners now have enough information to understand the data collected from their community
1306,They should be working on presenting their data on the use of fertiliser in their area and should be able to interpret their findings
1307,Learners work on their investigation in class The learners should work on their investigation on the use of fertilisers in their area in class
